{
  "id": "rnn-lstm-baseline",
  "title": "Sequence Models: the RNN/LSTM Baseline",
  "type": "concept",
  "oneLineScope": "The recurrent sequence models transformers replaced, and the two problems — vanishing gradients and inherent sequentiality — that doomed them.",
  "wordCount": 1510,
  "prose": "<p><em>Where we are.</em> Before transformers, this is how neural networks handled sequences &mdash; and these are the two problems that motivated everything that came after. If you have been reading this graph in order, you have just seen how word embeddings give each token a position in a continuous vector space. The natural next question is: how does a network actually <em>process</em> a sequence of those vectors? The answer, through most of the 2010s, was the recurrent neural network, extended by the Long Short-Term Memory cell. Understanding what these models do and where they break is the prerequisite for understanding why alignment, attention, and ultimately the transformer were necessary.</p>\n\n<p><em>The gist.</em> A recurrent net reads a sequence one token at a time, threading a hidden state from step to step that is supposed to carry everything relevant from the past. LSTMs improve on this by adding learned gates that can preserve information across many steps, solving the worst of the gradient problems. But two fundamental difficulties remain. First, gradients still struggle to carry information across very long distances &mdash; the vanishing-gradient problem is mitigated, not solved. Second, and more important for scaling, the sequential structure is irreducible: each step must wait for the previous one, so you cannot parallelize across the length of a sequence no matter how many processors you have.</p>\n\n<p><em>Why it matters.</em> These two problems are the direct ancestors of the transformer&rsquo;s architecture. Attention fixes the long-range bottleneck by letting every position reach every other position directly, bypassing the sequential chain entirely. The next node, <em>alignment and attention</em>, traces how that fix was first discovered. Arriving at this node with the RNN&rsquo;s limitations clearly in mind is what makes that story legible.</p>\n\n<h3>The basic recurrent network</h3>\n<p>The core idea is simple enough to state in one sentence: use the same weights at every time step, and feed the previous output back in as an extra input. This is exactly the structure that was explored in the backprop-era PDP program. A plain RNN reads a sequence of tokens <em>(a token is the atomic unit the model operates on &mdash; a word, subword piece, or character)</em> left to right, updating a hidden state vector at each step:</p>\n\\[ h_t = f\\!\\left(W_x\\, x_t + W_h\\, h_{t-1} + b\\right) \\]\n<p>Here \\(x_t \\in \\mathbb{R}^{d_{\\text{in}}}\\) is the current input &mdash; typically a word embedding, a dense vector representing the token; \\(h_t, h_{t-1} \\in \\mathbb{R}^{d_h}\\) are the hidden states at steps \\(t\\) and \\(t{-}1\\), each a vector of width \\(d_h\\); \\(W_x \\in \\mathbb{R}^{d_h \\times d_{\\text{in}}}\\) and \\(W_h \\in \\mathbb{R}^{d_h \\times d_h}\\) are learned weight matrices <em>shared</em> across all steps; \\(b \\in \\mathbb{R}^{d_h}\\) is a bias; and \\(f\\) is a nonlinearity such as \\(\\tanh\\). An output can be read from \\(h_t\\) at each step, or only at the final step, depending on the task. The weight-sharing is the recurrence &mdash; the same \\(W_x\\) and \\(W_h\\) appear at every position.</p>\n<p>Training uses <strong>backpropagation through time</strong> (BPTT): unroll the recurrence into a computation graph with \\(T\\) copies of the same weights, then run ordinary backpropagation on that unrolled graph. If you know backprop, you already know BPTT &mdash; the only novelty is that \\(W_h\\) appears at every step, so its gradient is the sum of contributions from all positions. This is exactly the structure from the PDP literature, just applied to a sequential chain rather than a feedforward stack.</p>\n<figure data-dia=\"d1\"></figure>\n\n<h3>Problem 1 &mdash; vanishing and exploding gradients</h3>\n<p>Imagine tracing a signal that must travel from token 1 to token 50: something early in a sentence that matters for understanding something near the end. The gradient of the loss with respect to an early hidden state \\(h_k\\) flows back through the chain \\(h_T \\to h_{T-1} \\to \\cdots \\to h_k\\). At each step it is multiplied by the Jacobian of \\(f\\) with respect to the previous state &mdash; roughly a factor of \\(\\|W_h\\|\\) combined with the derivative of \\(f\\). Across \\(T - k\\) steps, that factor is raised to the \\((T{-}k)\\)-th power. If the dominant singular value of the relevant Jacobian is less than one, the gradient shrinks exponentially toward zero; if it exceeds one, it explodes. Bengio, Simard, and Frasconi (1994) gave the precise analysis: long-range dependencies require gradients to carry information across many steps, but the geometry of the loss surface makes this exponentially unlikely for plain nonlinear recurrences.</p>\n<p>In practice, a plain RNN learns short-range patterns reliably and long-range dependencies unreliably. Exploding gradients can be patched by clipping the gradient norm before the update. Vanishing gradients are the harder problem: you cannot amplify a signal that has already decayed to nothing. This is where the LSTM intervenes.</p>\n\n<h3>The LSTM: a gated cell state</h3>\n<p>Hochreiter and Schmidhuber (1997) introduced the Long Short-Term Memory cell specifically to address vanishing gradients. The key insight is to give the network a separate <strong>cell state</strong> \\(C_t \\in \\mathbb{R}^{d_h}\\) that is updated <em>additively</em> rather than through a squashing nonlinearity. Addition, unlike repeated multiplication by a saturating sigmoid, does not shrink a gradient. Hochreiter called this the <em>constant error carousel</em>: a signal can ride the additive highway for many steps without decaying. The move is analogous to residual connections in deep feedforward networks &mdash; the same trick of addition over multiplication, applied in the time direction rather than the depth direction.</p>\n<p>Three sigmoid gates, each a learned linear function of the concatenation \\([h_{t-1}; x_t]\\) followed by a logistic sigmoid \\(\\sigma\\), control what the cell retains, writes, and reads:</p>\n<ul>\n<li>The <strong>forget gate</strong> \\(f_t = \\sigma(W_f [h_{t-1}; x_t] + b_f) \\in (0,1)^{d_h}\\) element-multiplies \\(C_{t-1}\\), deciding what fraction of each memory dimension to keep: \\(f_t \\approx 0\\) erases, \\(f_t \\approx 1\\) preserves.</li>\n<li>The <strong>input gate</strong> \\(i_t = \\sigma(W_i [h_{t-1}; x_t] + b_i)\\) and a <strong>candidate update</strong> \\(\\tilde{C}_t = \\tanh(W_c [h_{t-1}; x_t] + b_c)\\) together write new content: the term \\(i_t \\odot \\tilde{C}_t\\) is added to the (possibly erased) cell state.</li>\n<li>The <strong>output gate</strong> \\(o_t = \\sigma(W_o [h_{t-1}; x_t] + b_o)\\) reads from the updated cell to produce the hidden state: \\(h_t = o_t \\odot \\tanh(C_t)\\).</li>\n</ul>\n<p>Putting the cell update and the readout together:</p>\n\\[ C_t = f_t \\odot C_{t-1} + i_t \\odot \\tilde{C}_t \\]\n\\[ h_t = o_t \\odot \\tanh(C_t) \\]\n<p>The \\(\\odot\\) symbol denotes element-wise (Hadamard) multiplication. The additive structure of the \\(C_t\\) update is what matters for gradients: \\(\\partial C_t / \\partial C_{t-1} = f_t\\), which the network learns to hold near one when long-range information must be preserved, giving gradients an unattenuated path back through time.</p>\n<figure data-dia=\"d2\"></figure>\n<p>The <strong>Gated Recurrent Unit</strong> (Cho et al., 2014) is a streamlined variant: it merges the forget and input gates into a single <em>update gate</em> and eliminates the separate cell state, yielding a two-gate cell that is cheaper to compute and performs comparably to the LSTM on moderate sequence lengths.</p>\n\n<h3>Seq2seq and the fixed-vector bottleneck</h3>\n<p>With LSTMs as building blocks, Sutskever, Vinyals, and Le (2014) &mdash; and independently Cho et al. (2014) &mdash; introduced the <strong>encoder&ndash;decoder</strong> (<em>seq2seq</em>) architecture for tasks that map one sequence to another, such as machine translation and summarization. An encoder LSTM reads the entire source sequence and compresses it into a single fixed-length vector &mdash; the final hidden state \\(h_T \\in \\mathbb{R}^{d_h}\\). A decoder LSTM is then initialized with that vector and generates the target sequence token by token, conditioning each step on the same fixed vector plus whatever the decoder has generated so far.</p>\n<p>This works, and it was a significant step forward. But the fixed-length bottleneck is exactly what the name implies: every word the decoder will ever need to consult &mdash; every cross-lingual correspondence, every long-distance agreement &mdash; must be packed into one vector of width \\(d_h\\). For short sentences this is manageable. For longer ones, quality degrades measurably as the source length increases, which is visible in the empirical results of Sutskever et al. The encoder has no principled way to decide which information to prioritize when compressing, and the decoder has no way to revisit specific source positions. The <em>alignment and attention</em> node is the direct fix: rather than compressing the source into one vector, keep all of the encoder&rsquo;s hidden states and let the decoder learn a soft, dynamic pointer back to whichever source positions it currently needs.</p>\n\n<h3>Problem 2 &mdash; inherent sequentiality</h3>\n<p>Even if the vanishing-gradient problem were fully solved, a second structural difficulty would remain. Because \\(h_t\\) depends on \\(h_{t-1}\\), each step of the forward pass must wait for the previous one to complete. On a sequence of length \\(n\\), the recurrence requires \\(n\\